{
  "$schema": "http://json-schema.org/draft-07/schema#",
  "title": "Lambda Container Service Configuration",
  "description": "Configuration file for setting up a new microservice from the template",
  "type": "object",
  "required": [
    "project",
    "aws",
    "branding"
  ],
  "properties": {
    "project": {
      "type": "object",
      "required": ["name", "description"],
      "properties": {
        "name": {
          "type": "string",
          "pattern": "^[a-z0-9-]+$",
          "description": "Project name (lowercase, hyphens only)"
        },
        "displayName": {
          "type": "string",
          "description": "Human-readable project name"
        },
        "description": {
          "type": "string",
          "description": "Project description"
        },
        "version": {
          "type": "string",
          "default": "1.0.0",
          "description": "Initial project version"
        },
        "author": {
          "type": "string",
          "description": "Project author"
        },
        "repository": {
          "type": "string",
          "format": "uri",
          "description": "Git repository URL"
        }
      }
    },
    "aws": {
      "type": "object",
      "required": ["accountId", "region"],
      "properties": {
        "accountId": {
          "type": "string",
          "pattern": "^[0-9]{12}$",
          "description": "AWS Account ID (12 digits)"
        },
        "region": {
          "type": "string",
          "description": "Primary AWS region"
        },
        "lambdaFunctionName": {
          "type": "string",
          "description": "Lambda function name (defaults to project name + '-lambda')"
        },
        "ecrRepository": {
          "type": "string",
          "description": "ECR repository name (defaults to project name)"
        },
        "environments": {
          "type": "object",
          "properties": {
            "production": {
              "type": "string",
              "description": "Production workspace/environment ID"
            },
            "beta": {
              "type": "string",
              "description": "Beta/staging workspace/environment ID"
            },
            "development": {
              "type": "string",
              "description": "Development workspace/environment ID"
            }
          }
        }
      }
    },
    "branding": {
      "type": "object",
      "required": ["serviceName"],
      "properties": {
        "serviceName": {
          "type": "string",
          "description": "Service display name for UI"
        },
        "companyName": {
          "type": "string",
          "description": "Company name for copyright and branding"
        },
        "logoPath": {
          "type": "string",
          "default": "/bulb.png",
          "description": "Logo image path"
        },
        "primaryColor": {
          "type": "string",
          "pattern": "^#[0-9a-fA-F]{6}$",
          "description": "Primary brand color (hex)"
        }
      }
    },
    "server": {
      "type": "object",
      "properties": {
        "port": {
          "type": "number",
          "default": 4100,
          "description": "Default server port"
        },
        "apiPrefix": {
          "type": "string",
          "default": "api",
          "description": "API route prefix"
        }
      }
    },
    "features": {
      "type": "object",
      "properties": {
        "healthCheck": {
          "type": "boolean",
          "default": true,
          "description": "Enable health check endpoints"
        },
        "swagger": {
          "type": "boolean",
          "default": true,
          "description": "Enable Swagger API documentation"
        },
        "webUI": {
          "type": "boolean",
          "default": true,
          "description": "Enable web UI pages"
        }
      }
    }
  }
}
